{
  "settingId": "spuk_im_schlosskeller",
  "bereich": "gespraech",
  "hinweis": "Pflichtgespräche Runde 2, Besetzungsplätze 13 bis 16.",
  "eintraege": [
    {
      "id": "g_serkan_2_1",
      "rolle": "serkan",
      "runde": 2,
      "nr": 1,
      "partner": "murat",
      "thema": "Auffälliges im Dunkeln",
      "ziel": "Ich will wissen, ob im Dunkeln jemand raus wollte.",
      "preisgabe": [],
      "text": "Ist dir im Dunkeln was Komisches aufgefallen? Ich fahr nachher alle heim. Da muss ich wissen, ob jemand raus wollte."
    },
    {
      "id": "g_serkan_2_2",
      "rolle": "serkan",
      "runde": 2,
      "nr": 2,
      "partner": "meryem",
      "thema": "Der Platz am Tor",
      "ziel": "Ich will die Angaben der anderen prüfen, ohne selbst verdächtig zu wirken.",
      "preisgabe": [
        "beobachtung:b_serkan_tor"
      ],
      "text": "Du, ich stand von kurz vor zwölf bis nach zwölf am Außentor. Das Tor war zu, und keiner ist hinaus. Und du? Erzähl mal genau, was du da gemacht hast."
    },
    {
      "id": "g_serkan_2_3",
      "rolle": "serkan",
      "runde": 2,
      "nr": 3,
      "partner": "tim",
      "thema": "Unterwegs im Dunkeln?",
      "ziel": "Ich will wissen, ob im Dunkeln jemand ungewöhnlich unterwegs war.",
      "preisgabe": [],
      "text": "Warst du im Dunkeln eigentlich irgendwo unterwegs? Ist dir dabei jemand aufgefallen?"
    },
    {
      "id": "g_aylin_2_1",
      "rolle": "aylin",
      "runde": 2,
      "nr": 1,
      "partner": "ahmet",
      "thema": "Frage zur Miete",
      "ziel": "Ich will mit Ahmet unter vier Augen klären, wie ich mein Geld zurückbekomme.",
      "preisgabe": [
        "beobachtung:b_aylin_quittung"
      ],
      "text": "Ahmet, auf Herrn Schneiders Quittungszettel steht: Miete, null Euro. Wie kommt das?"
    },
    {
      "id": "g_aylin_2_2",
      "rolle": "aylin",
      "runde": 2,
      "nr": 2,
      "partner": "emine",
      "thema": "Genau erzählen",
      "ziel": "Ich will genau wissen, wer beim Knall wo stand, ohne gleich über Geld zu reden.",
      "preisgabe": [],
      "text": "Erzähl mal genau, wo du beim Knall warst. Da will ich nichts übersehen."
    },
    {
      "id": "g_aylin_2_3",
      "rolle": "aylin",
      "runde": 2,
      "nr": 3,
      "partner": "baran",
      "thema": "Auffälliges am Buffet",
      "ziel": "Ich will wissen, ob am Buffet jemand auffällig war.",
      "preisgabe": [],
      "text": "Was war vorhin am Buffet los? Hat sich da jemand komisch benommen?"
    },
    {
      "id": "g_kaan_2_1",
      "rolle": "kaan",
      "runde": 2,
      "nr": 1,
      "partner": "zeynep",
      "thema": "Wer ging durch die Bogentür?",
      "ziel": "Ich will wissen, wo mein Gegenüber im Dunkeln war.",
      "preisgabe": [
        "beobachtung:b_wojtek_vorbei"
      ],
      "text": "Im Dunkeln hat sich jemand an mir vorbeigedrängt, an der Bogentür zum Turm. Wo warst du da eigentlich?"
    },
    {
      "id": "g_kaan_2_2",
      "rolle": "kaan",
      "runde": 2,
      "nr": 2,
      "partner": "olli",
      "thema": "Was wolltest du mit Herrn Schneider?",
      "ziel": "Ich will wissen, was Olli mit Herrn Schneider besprechen wollte.",
      "preisgabe": [
        "beobachtung:b_wojtek_olli_satz"
      ],
      "text": "Olli, um acht vor zwölf hast du mir Eis versprochen. Und dann wolltest du mit Herrn Schneider reden. Was genau wolltest du von ihm?"
    },
    {
      "id": "g_kaan_2_3",
      "rolle": "kaan",
      "runde": 2,
      "nr": 3,
      "partner": "leyla",
      "thema": "Olli nach dem Knall",
      "ziel": "Ich will wissen, ob jemand Olli nach dem Knall gesehen hat.",
      "preisgabe": [],
      "text": "Hast du Olli nach dem Knall irgendwo gesehen?"
    },
    {
      "id": "g_dilara_2_1",
      "rolle": "dilara",
      "runde": 2,
      "nr": 1,
      "partner": "fatma",
      "thema": "Deine Tasche um Viertel vor zwölf",
      "ziel": "Ich will wissen, was Fatma in der Tasche hatte, ohne selbst verdächtig zu wirken.",
      "preisgabe": [
        "beobachtung:b_azra_tasche"
      ],
      "text": "Fatma, deine Tasche war um Viertel vor zwölf auffällig prall. Was war da drin?"
    },
    {
      "id": "g_dilara_2_2",
      "rolle": "dilara",
      "runde": 2,
      "nr": 2,
      "partner": "leyla",
      "thema": "Wie genau beim Knall?",
      "ziel": "Ich will erfahren, wer beim Knall am Buffet stand.",
      "preisgabe": [
        "beobachtung:b_azra_versteck"
      ],
      "text": "Wie genau warst du beim Knall? Ich kauerte am rechten Buffettisch und blieb dort, bis es wieder hell wurde."
    },
    {
      "id": "g_dilara_2_3",
      "rolle": "dilara",
      "runde": 2,
      "nr": 3,
      "partner": "meryem",
      "thema": "Nach dem Knall",
      "ziel": "Ich will wissen, ob nach dem Knall jemand auffällig war.",
      "preisgabe": [],
      "text": "Ist dir nach dem Knall irgendwas komisch vorgekommen?"
    }
  ]
}
